
    =========================== USB Port4 ===========================

Connection Status        : 0x01 (Device is connected)
Port Chain               : 1-2-2-4
Properties               : 0x01
 IsUserConnectable       : yes
 PortIsDebugCapable      : no
 PortHasMultiCompanions  : no
 PortConnectorIsTypeC    : no
ConnectionIndex          : 0x04 (Port 4)
CompanionIndex           : 0
 CompanionHubSymLnk      : USB#VID_2109&PID_0813#6&c8f3955&0&2#{f18a0e88-c30c-11d0-8815-00a0c906bed8}
 CompanionPortNumber     : 0x04 (Port 4)
 -> CompanionPortChain   : 1-24-2-4

      ========================== Summary =========================
Vendor ID                : 0x0483 (STMicroelectronics)
Product ID               : 0x5711
USB Version              : 2.0 -> but Device is Full-Speed only
Port maximum Speed       : High-Speed (Companion Port 1-24-2-4 supports SuperSpeed)
Device maximum Speed     : Full-Speed
Device Connection Speed  : Full-Speed
Self powered             : no
Demanded Current         : 500 mA
Used Endpoints           : 3

      ======================== USB Device ========================

        +++++++++++++++++ Device Information ++++++++++++++++++
Device Description       : USB Composite Device
Device Path              : \\?\USB#VID_0483&PID_5711#3785389D3030#{a5dcbf10-6530-11d2-901f-00c04fb951ed} (GUID_DEVINTERFACE_USB_DEVICE)
Kernel Name              : \Device\USBPDO-26
Device ID                : USB\VID_0483&PID_5711\3785389D3030
Hardware IDs             : USB\VID_0483&PID_5711&REV_0000 USB\VID_0483&PID_5711
Driver KeyName           : {36fc9e60-c465-11cf-8056-444553540000}\0024 (GUID_DEVCLASS_USB)
Driver                   : \SystemRoot\System32\drivers\usbccgp.sys (Version: 10.0.26100.4768  Date: 2025-08-12)
Driver Inf               : C:\WINDOWS\inf\usb.inf
Legacy BusType           : PNPBus
Class                    : USB
Class GUID               : {36fc9e60-c465-11cf-8056-444553540000} (GUID_DEVCLASS_USB)
Service                  : usbccgp
Enumerator               : USB
Location Info            : Port_#0004.Hub_#0015
Location IDs             : PCIROOT(0)#PCI(1400)#USBROOT(0)#USB(2)#USB(2)#USB(4), ACPI(_SB_)#ACPI(PC00)#ACPI(XHCI)#ACPI(RHUB)#ACPI(HS02)#ACPI(HSS2)#USB(4)
Container ID             : {12559e5a-93bd-5954-993e-b081b98802a4}
Manufacturer Info        : (Standard USB Host Controller)
Capabilities             : 0x94 (Removable, UniqueID, SurpriseRemovalOK)
Status                   : 0x0180600A (DN_DRIVER_LOADED, DN_STARTED, DN_DISABLEABLE, DN_REMOVABLE, DN_NT_ENUMERATOR, DN_NT_DRIVER)
Problem Code             : 0
Address                  : 4
Power State              : D0 (supported: D0, D2, D3, wake from D0, wake from D2)
 Child Device 1          : BLACKPILL_F411CE HID in FS Mode (USB Audio Device)
  Device Path 1          : \\?\USB#VID_0483&PID_5711&MI_00#8&1135d999&0&0000#{6994ad04-93ef-11d0-a3cc-00a0c9223196}\global (AM_KSCATEGORY_AUDIO)
  Device Path 2          : \\?\USB#VID_0483&PID_5711&MI_00#8&1135d999&0&0000#{65e8773d-8f56-11d0-a3b9-00a0c9223196}\global (AM_KSCATEGORY_CAPTURE)
  Device Path 3          : \\?\USB#VID_0483&PID_5711&MI_00#8&1135d999&0&0000#{65e8773e-8f56-11d0-a3b9-00a0c9223196}\global (AM_KSCATEGORY_RENDER)
  Kernel Name            : \Device\00000161
  Device ID              : USB\VID_0483&PID_5711&MI_00\8&1135D999&0&0000
  Class                  : MEDIA
  Driver KeyName         : {4d36e96c-e325-11ce-bfc1-08002be10318}\0007 (GUID_DEVCLASS_MEDIA)
  Service                : usbaudio
  Location               : 0000.0014.0000.002.002.004.000.000.000
  LocationPaths          : PCIROOT(0)#PCI(1400)#USBROOT(0)#USB(2)#USB(2)#USB(4)#USBMI(0)  PCIROOT(0)#PCI(1400)#USBROOT(0)#USB(2)#USB(2)#USB(4)#USB(4)  ACPI(_SB_)#ACPI(PC00)#ACPI(XHCI)#ACPI(RHUB)#ACPI(HS02)#ACPI(HSS2)#USB(4)#USBMI(0)  ACPI(_SB_)#ACPI(PC00)#ACPI(XHCI)#ACPI(RHUB)#ACPI(HS02)#ACPI(HSS2)#USB(4)#USB(4)
   Child Device 1        : BLACKPILL_F411CE HID in FS Mode [0] (Generic software device)
    Device Path          : \\?\SWD#MMDEVAPI#MIDII_D2A334A2.P_0000#{6dc23320-ab33-4ce4-80d4-bbb3ebbf2814} (DEVINTERFACE_MIDI_OUTPUT)
    Kernel Name          : \Device\00000163
    Device ID            : SWD\MMDEVAPI\MIDII_D2A334A2.P_0000
    Class                : SoftwareDevice
    Driver KeyName       : {62f9c741-b25a-46ce-b54c-9bccce08b6f2}\0020 (GUID_DEVCLASS_SWD)
   Child Device 2        : BLACKPILL_F411CE HID in FS Mode [1] (Generic software device)
    Device Path          : \\?\SWD#MMDEVAPI#MIDII_D2A334A2.P_0001#{504be32c-ccf6-4d2c-b73f-6f8b3747e22b} (DEVINTERFACE_MIDI_INPUT)
    Kernel Name          : \Device\00000164
    Device ID            : SWD\MMDEVAPI\MIDII_D2A334A2.P_0001
    Class                : SoftwareDevice
    Driver KeyName       : {62f9c741-b25a-46ce-b54c-9bccce08b6f2}\0021 (GUID_DEVCLASS_SWD)

        +++++++++++++++++ Registry USB Flags +++++++++++++++++
HKEY_LOCAL_MACHINE\SYSTEM\CurrentControlSet\Control\usbflags\048357110000
 osvc                    : REG_BINARY 00 00
 NewInterfaceUsage       : REG_DWORD 00000000 (0)

        ---------------- Connection Information ---------------
Connection Index         : 0x04 (Port 4)
Connection Status        : 0x01 (DeviceConnected)
Current Config Value     : 0x01 (Configuration 1)
Device Address           : 0x3D (61)
Is Hub                   : 0x00 (no)
Device Bus Speed         : 0x01 (Full-Speed)
Number Of Open Pipes     : 0x02 (2 pipes to data endpoints)
Pipe[0]                  : EndpointID=1  Direction=OUT  ScheduleOffset=0  Type=Bulk  wMaxPacketSize=0x40    bInterval=0  
Pipe[1]                  : EndpointID=2  Direction=IN   ScheduleOffset=0  Type=Bulk  wMaxPacketSize=0x40    bInterval=0  
Data (HexDump)           : 04 00 00 00 12 01 00 02 00 00 00 40 83 04 11 57   ...........@...W
                           00 00 01 02 03 01 01 01 00 3D 00 02 00 00 00 01   .........=......
                           00 00 00 09 05 01 02 40 00 00 00 00 00 00 09 05   .......@........
                           82 02 40 00 00 00 00 00 00                        ..@......

        --------------- Connection Information V2 -------------
Connection Index         : 0x04 (4)
Length                   : 0x10 (16 bytes)
SupportedUsbProtocols    : 0x03
 Usb110                  : 1 (yes, port supports USB 1.1)
 Usb200                  : 1 (yes, port supports USB 2.0)
 Usb300                  : 0 (no, port not supports USB 3.0) -> but Companion Port 1-24-2-4 does
 ReservedMBZ             : 0x00
Flags                    : 0x00
 DevIsOpAtSsOrHigher     : 0 (Device is not operating at SuperSpeed or higher)
 DevIsSsCapOrHigher      : 0 (Device is not SuperSpeed capable or higher)
 DevIsOpAtSsPlusOrHigher : 0 (Device is not operating at SuperSpeedPlus or higher)
 DevIsSsPlusCapOrHigher  : 0 (Device is not SuperSpeedPlus capable or higher)
 ReservedMBZ             : 0x00
Data (HexDump)           : 04 00 00 00 10 00 00 00 03 00 00 00 00 00 00 00   ................

    ---------------------- Device Descriptor ----------------------
bLength                  : 0x12 (18 bytes)
bDescriptorType          : 0x01 (Device Descriptor)
bcdUSB                   : 0x200 (USB Version 2.0) -> but device is Full-Speed only
bDeviceClass             : 0x00 (defined by the interface descriptors)
bDeviceSubClass          : 0x00
bDeviceProtocol          : 0x00
bMaxPacketSize0          : 0x40 (64 bytes)
idVendor                 : 0x0483 (STMicroelectronics)
idProduct                : 0x5711
bcdDevice                : 0x0000
iManufacturer            : 0x01 (String Descriptor 1)
 Language 0x0409         : "STMicroelectronics"
iProduct                 : 0x02 (String Descriptor 2)
 Language 0x0409         : "BLACKPILL_F411CE HID in FS Mode"
iSerialNumber            : 0x03 (String Descriptor 3)
 Language 0x0409         : "3785389D3030"
bNumConfigurations       : 0x01 (1 Configuration)
Data (HexDump)           : 12 01 00 02 00 00 00 40 83 04 11 57 00 00 01 02   .......@...W....
                           03 01                                             ..

    ------------------ Configuration Descriptor -------------------
bLength                  : 0x09 (9 bytes)
bDescriptorType          : 0x02 (Configuration Descriptor)
wTotalLength             : 0x006D (109 bytes)
bNumInterfaces           : 0x02 (2 Interfaces)
bConfigurationValue      : 0x01 (Configuration 1)
iConfiguration           : 0x00 (No String Descriptor)
bmAttributes             : 0x80
 D7: Reserved, set 1     : 0x01
 D6: Self Powered        : 0x00 (no)
 D5: Remote Wakeup       : 0x00 (no)
 D4..0: Reserved, set 0  : 0x00
MaxPower                 : 0xFA (500 mA)
Data (HexDump)           : 09 02 6D 00 02 01 00 80 FA 08 0B 00 02 01 01 00   ..m.............
                           00 09 04 00 00 00 01 01 00 00 09 24 01 00 01 09   ...........$....
                           00 01 01 09 04 01 00 02 01 03 00 00 07 24 01 00   .............$..
                           01 41 00 06 24 02 01 01 00 06 24 02 02 02 00 09   .A..$.....$.....
                           24 03 01 03 01 02 01 00 09 24 03 02 04 01 01 01   $........$......
                           00 09 05 01 02 40 00 00 00 00 05 25 01 01 01 09   .....@.....%....
                           05 82 02 40 00 00 00 00 05 25 01 01 03            ...@.....%...

        ------------------- IAD Descriptor --------------------
bLength                  : 0x08 (8 bytes)
bDescriptorType          : 0x0B (Interface Association Descriptor)
bFirstInterface          : 0x00 (Interface 0)
bInterfaceCount          : 0x02 (2 Interfaces)
bFunctionClass           : 0x01 (Audio)
bFunctionSubClass        : 0x01 (Audio Control)
bFunctionProtocol        : 0x00
iFunction                : 0x00 (No String Descriptor)
Data (HexDump)           : 08 0B 00 02 01 01 00 00                           ........

        ---------------- Interface Descriptor -----------------
bLength                  : 0x09 (9 bytes)
bDescriptorType          : 0x04 (Interface Descriptor)
bInterfaceNumber         : 0x00 (Interface 0)
bAlternateSetting        : 0x00
bNumEndpoints            : 0x00 (Default Control Pipe only)
bInterfaceClass          : 0x01 (Audio)
bInterfaceSubClass       : 0x01 (Audio Control)
bInterfaceProtocol       : 0x00
iInterface               : 0x00 (No String Descriptor)
Data (HexDump)           : 09 04 00 00 00 01 01 00 00                        .........

        ------ Audio Control Interface Header Descriptor ------
bLength                  : 0x09 (9 bytes)
bDescriptorType          : 0x24 (Audio Interface Descriptor)
bDescriptorSubtype       : 0x01 (Header)
bcdADC                   : 0x0100
wTotalLength             : 0x0009 (9 bytes)
bInCollection            : 0x01
baInterfaceNr[1]         : 0x01
Data (HexDump)           : 09 24 01 00 01 09 00 01 01                        .$.......

        ---------------- Interface Descriptor -----------------
bLength                  : 0x09 (9 bytes)
bDescriptorType          : 0x04 (Interface Descriptor)
bInterfaceNumber         : 0x01 (Interface 1)
bAlternateSetting        : 0x00
bNumEndpoints            : 0x02 (2 Endpoints)
bInterfaceClass          : 0x01 (Audio)
bInterfaceSubClass       : 0x03 (MIDI Streaming)
bInterfaceProtocol       : 0x00
iInterface               : 0x00 (No String Descriptor)
Data (HexDump)           : 09 04 01 00 02 01 03 00 00                        .........

        - MIDI Adapter Class specific MS Interface Descriptor -
bLength                  : 0x07 (7 bytes)
bDescriptorType          : 0x24 (Class Specific Interface Descriptor)
bDescriptorSubtype       : 0x01 (MS Header)
bcdADC                   : 0x0100
wTotalLength             : 0x0041 (65 bytes)
Data (HexDump)           : 07 24 01 00 01 41 00 06 24 02 01 01 00 06 24 02   .$...A..$.....$.
                           02 02 00 09 24 03 01 03 01 02 01 00 09 24 03 02   ....$........$..
                           04 01 01 01 00 09 05 01 02 40 00 00 00 00 05 25   .........@.....%
                           01 01 01 09 05 82 02 40 00 00 00 00 05 25 01 01   .......@.....%..
                           03                                                .

        ---------------- MIDI IN Jack Descriptor --------------
bLength                  : 0x06 (6 bytes)
bDescriptorType          : 0x24 (Class Specific Interface Descriptor)
bDescriptorSubtype       : 0x02 (MIDI_IN_JACK)
bJackType                : 0x01 (Embedded)
bJackID                  : 0x01 (ID=1)
iJack                    : 0x00 (No String Descriptor)
Data (HexDump)           : 06 24 02 01 01 00                                 .$....

        ---------------- MIDI IN Jack Descriptor --------------
bLength                  : 0x06 (6 bytes)
bDescriptorType          : 0x24 (Class Specific Interface Descriptor)
bDescriptorSubtype       : 0x02 (MIDI_IN_JACK)
bJackType                : 0x02 (External)
bJackID                  : 0x02 (ID=2)
iJack                    : 0x00 (No String Descriptor)
Data (HexDump)           : 06 24 02 02 02 00                                 .$....

        --------------- MIDI OUT Jack Descriptor --------------
bLength                  : 0x09 (9 bytes)
bDescriptorType          : 0x24 (Class Specific Interface Descriptor)
bDescriptorSubtype       : 0x03 (MIDI_OUT_JACK)
bJackType                : 0x01 (Embedded)
bJackID                  : 0x03 (ID=3)
bNrInputPins             : 0x01 (1 pin)
baSourceID[1]            : 0x02 (input pin connected to entity ID=2)
baSourcePin[1]           : 0x01 (connected to input pin number 1
iJack                    : 0x00 (No String Descriptor)
Data (HexDump)           : 09 24 03 01 03 01 02 01 00                        .$.......

        --------------- MIDI OUT Jack Descriptor --------------
bLength                  : 0x09 (9 bytes)
bDescriptorType          : 0x24 (Class Specific Interface Descriptor)
bDescriptorSubtype       : 0x03 (MIDI_OUT_JACK)
bJackType                : 0x02 (External)
bJackID                  : 0x04 (ID=4)
bNrInputPins             : 0x01 (1 pin)
baSourceID[1]            : 0x01 (input pin connected to entity ID=1)
baSourcePin[1]           : 0x01 (connected to input pin number 1
iJack                    : 0x00 (No String Descriptor)
Data (HexDump)           : 09 24 03 02 04 01 01 01 00                        .$.......

        ----------------- Endpoint Descriptor -----------------
bLength                  : 0x09 (9 bytes)
bDescriptorType          : 0x05 (Endpoint Descriptor)
bEndpointAddress         : 0x01 (Direction=OUT EndpointID=1)
bmAttributes             : 0x02 (TransferType=Bulk)
wMaxPacketSize           : 0x0040 (64 bytes)
bInterval                : 0x00 (0 ms)
bRefresh                 : 0x00
bSynchAddress            : 0x00
Data (HexDump)           : 09 05 01 02 40 00 00 00 00                        ....@....

        --- Class-Specific MS Bulk Data Endpoint Descriptor ---
bLength                  : 0x05 (5 bytes)
bDescriptorType          : 0x25 (Audio Endpoint Descriptor)
bDescriptorSubtype       : 0x01 (MS General)
bNumEmbMIDIJack          : 0x01 (1 embedded MIDI jack)
baAssocJackID(1)         : 0x01 (Jack(1) ID=1)
Data (HexDump)           : 05 25 01 01 01                                    .%...

        ----------------- Endpoint Descriptor -----------------
bLength                  : 0x09 (9 bytes)
bDescriptorType          : 0x05 (Endpoint Descriptor)
bEndpointAddress         : 0x82 (Direction=IN EndpointID=2)
bmAttributes             : 0x02 (TransferType=Bulk)
wMaxPacketSize           : 0x0040 (64 bytes)
bInterval                : 0x00 (0 ms)
bRefresh                 : 0x00
bSynchAddress            : 0x00
Data (HexDump)           : 09 05 82 02 40 00 00 00 00                        ....@....

        --- Class-Specific MS Bulk Data Endpoint Descriptor ---
bLength                  : 0x05 (5 bytes)
bDescriptorType          : 0x25 (Audio Endpoint Descriptor)
bDescriptorSubtype       : 0x01 (MS General)
bNumEmbMIDIJack          : 0x01 (1 embedded MIDI jack)
baAssocJackID(1)         : 0x03 (Jack(1) ID=3)
Data (HexDump)           : 05 25 01 01 03                                    .%...

    ----------------- Device Qualifier Descriptor -----------------
Error                    : ERROR_GEN_FAILURE  (because the device is Full-Speed only)

      -------------------- String Descriptors -------------------
             ------ String Descriptor 0 ------
bLength                  : 0x04 (4 bytes)
bDescriptorType          : 0x03 (String Descriptor)
Language ID[0]           : 0x0409 (English - United States)
Data (HexDump)           : 04 03 09 04                                       ....
             ------ String Descriptor 1 ------
bLength                  : 0x26 (38 bytes)
bDescriptorType          : 0x03 (String Descriptor)
Language 0x0409          : "STMicroelectronics"
Data (HexDump)           : 26 03 53 00 54 00 4D 00 69 00 63 00 72 00 6F 00   &.S.T.M.i.c.r.o.
                           65 00 6C 00 65 00 63 00 74 00 72 00 6F 00 6E 00   e.l.e.c.t.r.o.n.
                           69 00 63 00 73 00                                 i.c.s.
             ------ String Descriptor 2 ------
bLength                  : 0x40 (64 bytes)
bDescriptorType          : 0x03 (String Descriptor)
Language 0x0409          : "BLACKPILL_F411CE HID in FS Mode"
Data (HexDump)           : 40 03 42 00 4C 00 41 00 43 00 4B 00 50 00 49 00   @.B.L.A.C.K.P.I.
                           4C 00 4C 00 5F 00 46 00 34 00 31 00 31 00 43 00   L.L._.F.4.1.1.C.
                           45 00 20 00 48 00 49 00 44 00 20 00 69 00 6E 00   E. .H.I.D. .i.n.
                           20 00 46 00 53 00 20 00 4D 00 6F 00 64 00 65 00    .F.S. .M.o.d.e.
             ------ String Descriptor 3 ------
bLength                  : 0x1A (26 bytes)
bDescriptorType          : 0x03 (String Descriptor)
Language 0x0409          : "3785389D3030"
Data (HexDump)           : 1A 03 33 00 37 00 38 00 35 00 33 00 38 00 39 00   ..3.7.8.5.3.8.9.
                           44 00 33 00 30 00 33 00 30 00                     D.3.0.3.0.

